[
	{
		"name": "PSC_ROM_EC_I2C_EXT_MSG_FAIL",
		"description": "Fail to enable I2C0 for Ext Messaging interface",
		"primary": "0xB0C0C001",
		"mask": "0xFEFF003F",
		"resolution": "PSC ROM failed to initialize the I2C0 external messaging interface. Reboot the system. If the same error code persists, this indicates a hardware problem. Contact NVIDIA for further assistance."
	},
	{
		"name": "PSC_ROM_EC_BOOT_MODE_SEL_FAIL",
		"description": "Fail to Detect Boot Mode and Boot Device",
		"primary": "0xB0C0C002",
		"mask": "0xFEFF003F",
		"resolution": "PSC ROM failed to detect the boot mode and boot device. This is typically caused by an incorrect strap configuration. Check the strap values in the BMC/HMC and compare them to the documented values for the platform. Contact NVIDIA if the strap values appear correct."
	},
	{
		"name": "PSC_ROM_EC_USB_EXT_MSG_FAIL",
		"description": "Fail to Enable USB composite device",
		"primary": "0xB0C0C003",
		"mask": "0xFEFF003F",
		"resolution": "PSC ROM failed to enable the USB composite device. Reboot the system. If the same error code persists, this indicates a hardware problem. Contact NVIDIA for further assistance."
	},
	{
		"name": "PSC_ROM_EC_EROT_GRANT_FAIL",
		"description": "Timeout to get FW QSPI access from eROT",
		"primary": "0xB0C0C004",
		"mask": "0xFEFF003F",
		"resolution": "PSC ROM timed out waiting for the eROT to grant access to the firmware QSPI flash. Check the eROT BOOT_COMPLETE status and Redfish messages for eROT failures. Reboot the system. If the issue persists, contact NVIDIA."
	},
	{
		"name": "PSC_ROM_EC_QSPI0_DEV_FAIL",
		"description": "Fail to Initialize QSPI as Boot Device",
		"primary": "0xB0C0C005",
		"mask": "0xFEFF003F",
		"resolution": "PSC ROM failed to initialize the QSPI0 flash device. If eROT is present, verify that QSPI read operations are functioning. Reboot the system. If the issue persists with eROT present, contact the eROT firmware vendor. If no eROT is present, contact NVIDIA."
	},
	{
		"name": "PSC_ROM_EC_USB2_DEV_FAIL",
		"description": "Fail to Initialize USB2 RCM as Boot Device",
		"primary": "0xB0C0C006",
		"mask": "0xFEFF003F",
		"resolution": "PSC ROM failed to initialize the USB2 device for recovery. Try the following steps: 1) Reboot the system. 2) Verify the USB cable is connected to the host. 3) Reconnect the USB cable. 4) Try connecting to a different port on the host. If all of the above fail, contact NVIDIA."
	},
	{
		"name": "PSC_ROM_EC_OCPRC_DEV_FAIL",
		"description": "Fail to Initialize OCP Recovery as Boot Device",
		"primary": "0xB0C0C007",
		"mask": "0xFEFF003F",
		"resolution": "PSC ROM failed to initialize OCP Recovery as a boot device. Power off and power on the system. If the same error persists, contact NVIDIA."
	},
	{
		"name": "PSC_ROM_EC_BOOT_CHAIN_EXHAUST",
		"description": "All boot chains exhausted",
		"primary": "0xB0C0C008",
		"mask": "0xFEFF003F",
		"resolution": "The device failed to boot after attempting both boot chains. Power off and power on the system. If the same issue persists, reflash the firmware images."
	},
	{
		"name": "PSC_ROM_EC_S2A_HEADER_CHECK_FAIL",
		"description": "Invalid S2A blob header",
		"primary": "0xB0C0C00B",
		"mask": "0xFEFF003F",
		"resolution": "The S2A DOT blob header is corrupted. The S2A DOT blob is provided by the OEM. The device will automatically reboot to read from the next slot. If both slots are corrupted, the device will enter recovery mode. Contact the OEM for a valid S2A DOT blob."
	},
	{
		"name": "PSC_ROM_EC_S2A_SANITY_FAIL",
		"description": "Sanity checks failed for S2A blob",
		"primary": "0xB0C0C00C",
		"mask": "0xFEFF003F",
		"resolution": "The S2A DOT blob failed sanity checks and appears corrupted. The S2A DOT blob is provided by the OEM. The device will automatically reboot to read from the next slot. If both slots are corrupted, the device will enter recovery mode. Contact the OEM for a valid S2A DOT blob."
	},
	{
		"name": "PSC_ROM_EC_S2A_INTEGRITY_FAIL",
		"description": "Fail to authenticate S2A blob",
		"primary": "0xB0C0C00D",
		"mask": "0xFEFF003F",
		"resolution": "The S2A DOT blob failed authentication and appears corrupted. The S2A DOT blob is provided by the OEM. The device will automatically reboot to read from the next slot. If both slots are corrupted, the device will enter recovery mode. Contact the OEM for a valid S2A DOT blob."
	},
	{
		"name": "PSC_ROM_EC_S2A_KEY_REVOKED",
		"description": "Keys from S2A blob are revoked",
		"primary": "0xB0C0C00E",
		"mask": "0xFEFF003F",
		"resolution": "The signing keys in the S2A DOT blob have been revoked. The device will automatically reboot to read from the next slot. If the next slot also has the same error, the device will enter recovery mode. Contact the OEM to obtain a new S2A DOT blob with a valid key index."
	},
	{
		"name": "PSC_ROM_EC_DOT_SLOT_EXHAUST",
		"description": "Fail to find valid S2A/DOT blob",
		"primary": "0xB0C0C00A",
		"mask": "0xFEFF003F",
		"resolution": "No valid DOT slot is available. The device will not boot and will enter recovery mode. Repair the DOT to resume booting. Check the DOT error codes from previous boots to understand the issue with the DOT blob."
	},
	{
		"name": "PSC_ROM_EC_MUTABLE_DOT_HEADER_CHECK_FAIL",
		"description": "Invalid Mutable DOT blob header",
		"primary": "0xB0C0C00F",
		"mask": "0xFEFF003F",
		"resolution": "The Mutable DOT blob header is corrupted. The device will automatically reboot to read from the next slot. If the next slot also has the same error, the device will enter recovery mode. Reflash the firmware with valid images."
	},
	{
		"name": "PSC_ROM_EC_MUTABLE_DOT_INTEGRITY_FAIL",
		"description": "Fail to authenticate Mutable DOT blob",
		"primary": "0xB0C0C010",
		"mask": "0xFEFF003F",
		"resolution": "The Mutable DOT blob failed authentication and appears corrupted. The device will automatically reboot to read from the next slot. If the next slot also has the same error, the device will enter recovery mode. Reflash the firmware with valid images."
	},
	{
		"name": "PSC_ROM_EC_MUTABLE_DOT_SANITY_FAIL",
		"description": "Sanity checks failed for Mutable DOT blob",
		"primary": "0xB0C0C011",
		"mask": "0xFEFF003F",
		"resolution": "The Mutable DOT blob failed sanity checks and appears corrupted. The device will automatically reboot to read from the next slot. If the next slot also has the same error, the device will enter recovery mode. Reflash the firmware with valid images."
	},
	{
		"name": "PSC_ROM_EC_VOLATILE_DOT_PARITY_FAIL",
		"description": "Ownership ram parity check failed for Volatile DOT blob",
		"primary": "0xB0C0C012",
		"mask": "0xFEFF003F",
		"resolution": "The Volatile DOT blob in ownership RAM has a parity error. The Volatile DOT blob contains the CAK. The device will reboot. To recover, send a correct Volatile DOT blob."
	},
	{
		"name": "PSC_ROM_EC_VOLATILE_DOT_HEADER_CHECK_FAIL",
		"description": "Invalid Volatile DOT blob header",
		"primary": "0xB0C0C013",
		"mask": "0xFEFF003F",
		"resolution": "The Volatile DOT blob header in ownership RAM is corrupted. The Volatile DOT blob contains the CAK. The device will reboot. To recover, send a correct Volatile DOT blob."
	},
	{
		"name": "PSC_ROM_EC_VOLATILE_DOT_SANITY_FAIL",
		"description": "Sanity checks failed for volatile DOT blob",
		"primary": "0xB0C0C014",
		"mask": "0xFEFF003F",
		"resolution": "The Volatile DOT blob in ownership RAM failed sanity checks. The Volatile DOT blob contains the CAK. The device will reboot. To recover, send a correct Volatile DOT blob."
	},
	{
		"name": "PSC_ROM_EC_FMC_CSH_SANITY_FAIL",
		"description": "Sanity checks failed for PSC-FMC CSH",
		"primary": "0xB0C0C016",
		"mask": "0xFEFF003F",
		"resolution": "The PSC-FMC image is corrupted. The device will reboot and attempt to boot from the alternate chain. If the alternate chain also fails, the device will enter recovery mode. Reflash the firmware with valid images to recover."
	},
	{
		"name": "PSC_ROM_EC_FMC_CSH_AUTHZ1_FAIL",
		"description": "Failed to validate stage 1 authenticity of PSC-FMC",
		"primary": "0xB0C0C017",
		"mask": "0xFEFF003F",
		"resolution": "The PSC-FMC image failed stage 1 authentication. The device will reboot and attempt to boot from the alternate chain. If the alternate chain also fails, the device will enter recovery mode. Reflash the firmware with valid images to recover."
	},
	{
		"name": "PSC_ROM_EC_FMC_CSH_AUTHZ2_FAIL",
		"description": "Failed to validate stage 2 authenticity of PSC-FMC",
		"primary": "0xB0C0C018",
		"mask": "0xFEFF003F",
		"resolution": "The PSC-FMC image failed stage 2 authentication. The device will reboot and attempt to boot from the alternate chain. If the alternate chain also fails, the device will enter recovery mode. Reflash the firmware with valid images to recover."
	},
	{
		"name": "PSC_ROM_EC_FMC_CSH_BIN_LIST_INTEGRITY_FAIL",
		"description": "CSH binary metadata list is corrupted",
		"primary": "0xB0C0C019",
		"mask": "0xFEFF003F",
		"resolution": "The PSC-FMC image binary metadata list is corrupted. The device will reboot and attempt to boot from the alternate chain. If the alternate chain also fails, the device will enter recovery mode. Reflash the firmware with valid images to recover."
	},
	{
		"name": "PSC_ROM_EC_FMC_IMAGE_SANITY_FAIL",
		"description": "Sanity checks for PSC-FMC are failed",
		"primary": "0xB0C0C01A",
		"mask": "0xFEFF003F",
		"resolution": "The PSC-FMC image failed sanity checks and is corrupted. The device will reboot and attempt to boot from the alternate chain. If the alternate chain also fails, the device will enter recovery mode. Reflash the firmware with valid images to recover."
	},
	{
		"name": "PSC_ROM_EC_FMC_IMAGE_INTEGRITY_FAIL",
		"description": "PSC-FMC binary is corrupted",
		"primary": "0xB0C0C01B",
		"mask": "0xFEFF003F",